{
  "schema_version": "1.0",
  "paper_id": "ringmoclaw",
  "source_sha256": "32df5e2843de7e8ccd52d56b9dfed257c26786ef3b71fbc397a1c3a5e26fb0fa",
  "created_at": "2026-10-14T09:49:01.994676+00:00",
  "central_question": "如何克服大模型在遥感科研中盲目试错、缺乏记忆与反思的瓶颈，实现自主进化的全闭环科研框架？",
  "motivation": "实验评测主要集中在遥感图像模式识别任务，多模态与时序扩展及多智能体通信开销仍待优化",
  "prior_assumptions_or_gap": "假定评测基准数据分布与真实遥感任务具备一致性",
  "central_thesis": "RingMoClaw 通过异构 Critic 与双流动态经验总线，在遥感多任务自演化探索中实现了超越基线模型与对标开源框架的探索效率与精度增益。",
  "story_spine": {
    "central_question": "如何克服大模型在遥感科研中盲目试错、缺乏记忆与反思的瓶颈，实现自主进化的全闭环科研框架？",
    "motivation": "实验评测主要集中在遥感图像模式识别任务，多模态与时序扩展及多智能体通信开销仍待优化",
    "prior_gap": "假定评测基准数据分布与真实遥感任务具备一致性",
    "central_move": "Introduction → Related Work → Methodology → Experiments → Discussion and Conclusion",
    "method_logic": "Paradigm Shift → Decoupled Architecture → Experience Bus → Empirical Validation",
    "experimental_questions": [
      "如何克服大模型在遥感科研中盲目试错、缺乏记忆与反思的瓶颈，实现自主进化的全闭环科研框架？"
    ],
    "major_findings": [
      "RingMoClaw 通过异构 Critic 与双流动态经验总线，在遥感多任务自演化探索中实现了超越基线模型与对标开源框架的探索效率与精度增益。"
    ],
    "justified_conclusion": "RingMoClaw 通过异构 Critic 与双流动态经验总线，在遥感多任务自演化探索中实现了超越基线模型与对标开源框架的探索效率与精度增益。",
    "scope_and_limits": [
      "假定评测基准数据分布与真实遥感任务具备一致性",
      "实验评测主要集中在遥感图像模式识别任务，多模态与时序扩展及多智能体通信开销仍待优化",
      "LEVIR-CD 变化检测评测中 F1 与 IoU 指标命名约定存在未决差异"
    ]
  },
  "argument_units": [
    {
      "id": "ARG-01",
      "semantic_role": "problem",
      "proposition": "如何克服大模型在遥感科研中盲目试错、缺乏记忆与反思的瓶颈，实现自主进化的全闭环科研框架？",
      "explanatory_narrative": "论文立足于如下核心关切展开：如何克服大模型在遥感科研中盲目试错、缺乏记忆与反思的瓶颈，实现自主进化的全闭环科研框架？，旨在解决既有方案的科学局限与未决问题。",
      "source_anchors": [
        "p.2"
      ],
      "linked_claim_ids": [],
      "linked_evidence_ids": [],
      "epistemic_status": "SUPPORTED",
      "confidence": "HIGH",
      "provenance": "paper_model.questions",
      "predecessor_ids": [],
      "successor_ids": [
        "ARG-02"
      ]
    },
    {
      "id": "ARG-02",
      "semantic_role": "method_rationale",
      "proposition": "提出'Introduction'以应对核心挑战",
      "explanatory_narrative": "作者提出解决思路：Introduction → Related Work → Methodology → Experiments → Discussion and Conclusion。假设该设计能够直接化解前述局限并建立有效映射。",
      "source_anchors": [
        "p.1"
      ],
      "linked_claim_ids": [
        "C01"
      ],
      "linked_evidence_ids": [],
      "epistemic_status": "SUPPORTED",
      "confidence": "HIGH",
      "provenance": "paper_model.methods",
      "predecessor_ids": [
        "ARG-01"
      ],
      "successor_ids": []
    },
    {
      "id": "ARG-03",
      "semantic_role": "result",
      "proposition": "RingMoClaw 通过异构 Critic 与双流动态经验总线，在遥感多任务自演化探索中实现了超越基线模型与对标开源框架的探索效率与精度增益。",
      "explanatory_narrative": "实证观测：在 FAIR1M 等多项基准上测得检测精度提升与算力耗时压减。。作者解读：作者认为双流经验与 Critic 机制形成了有效自演化闭环。。客观审视：在论文所列 4 类遥感视觉任务配置下得到实验证据支持。。",
      "source_anchors": [
        "p.2"
      ],
      "linked_claim_ids": [
        "C01"
      ],
      "linked_evidence_ids": [
        "F01",
        "F02",
        "F04",
        "F05",
        "T01",
        "T06",
        "T07",
        "T08",
        "T09",
        "T10"
      ],
      "epistemic_status": "SUPPORTED",
      "confidence": "HIGH",
      "provenance": "claim.C01",
      "predecessor_ids": [
        "ARG-02"
      ],
      "successor_ids": []
    },
    {
      "id": "ARG-04",
      "semantic_role": "limitation",
      "proposition": "方法适用边界与已知局限：实验评测主要集中在遥感图像模式识别任务，多模态与时序扩展及多智能体通信开销仍待优化",
      "explanatory_narrative": "审视表明该方法并非无条件成立，需注意前置条件：实验评测主要集中在遥感图像模式识别任务，多模态与时序扩展及多智能体通信开销仍待优化。",
      "source_anchors": [
        "p.1"
      ],
      "linked_claim_ids": [],
      "linked_evidence_ids": [],
      "epistemic_status": "PARTIAL",
      "confidence": "PARTIAL",
      "provenance": "paper_model.limitations",
      "predecessor_ids": [
        "ARG-03"
      ],
      "successor_ids": []
    },
    {
      "id": "ARG-05",
      "semantic_role": "conclusion",
      "proposition": "在所测试工况下核心主张成立，具备明确适用边界",
      "explanatory_narrative": "综合实证链条，论文成功支撑了主要论点；在超出测试范畴的复杂应用中，需持审慎验证态度。",
      "source_anchors": [
        "p.1"
      ],
      "linked_claim_ids": [
        "C01"
      ],
      "linked_evidence_ids": [
        "F01",
        "F02",
        "F04",
        "F05",
        "T01",
        "T06",
        "T07",
        "T08",
        "T09",
        "T10"
      ],
      "epistemic_status": "SUPPORTED",
      "confidence": "HIGH",
      "provenance": "evidentia_reconstruction",
      "predecessor_ids": [
        "ARG-03"
      ],
      "successor_ids": []
    }
  ],
  "argument_relations": [
    {
      "id": "REL-01",
      "from_unit": "ARG-01",
      "to_unit": "ARG-02",
      "relation_type": "motivates",
      "origin": "author",
      "evidence_refs": [],
      "notes": "核心问题促使作者形成该方法思路"
    },
    {
      "id": "REL-02",
      "from_unit": "ARG-02",
      "to_unit": "ARG-03",
      "relation_type": "tests",
      "origin": "author",
      "evidence_refs": [
        "F01",
        "F02",
        "F04",
        "F05",
        "T01",
        "T06",
        "T07",
        "T08",
        "T09",
        "T10"
      ],
      "notes": "通过实验检验主张 C01"
    },
    {
      "id": "REL-03",
      "from_unit": "ARG-03",
      "to_unit": "ARG-02",
      "relation_type": "supports",
      "origin": "evidentia_assessment",
      "evidence_refs": [
        "F01",
        "F02",
        "F04",
        "F05",
        "T01",
        "T06",
        "T07",
        "T08",
        "T09",
        "T10"
      ],
      "notes": "证据审视判定该实证观测对假设呈 supports 关系"
    },
    {
      "id": "REL-04",
      "from_unit": "ARG-04",
      "to_unit": "ARG-02",
      "relation_type": "qualifies",
      "origin": "evidentia_assessment",
      "evidence_refs": [],
      "notes": "识别出的适用边界与局限限制了核心主张的有效范畴"
    },
    {
      "id": "REL-05",
      "from_unit": "ARG-03",
      "to_unit": "ARG-05",
      "relation_type": "supports",
      "origin": "author",
      "evidence_refs": [],
      "notes": "作者从实证结果推导出的最终研究结论"
    }
  ],
  "turning_points": [
    "确立关键科学问题：如何克服大模型在遥感科研中盲目试错、缺乏记忆与反思的瓶颈，实现自主进化的全闭环科研框架？",
    "形成核心设计解法：Introduction",
    "实证证据检验：RingMoClaw 通过异构 Critic 与双流动态经验总线，在遥感多任务自演化探索中实现了超越基线模型与对标开源框架的探索效率与精度增益。"
  ],
  "scope_conditions": [
    "假定评测基准数据分布与真实遥感任务具备一致性"
  ],
  "limitations": [
    "实验评测主要集中在遥感图像模式识别任务，多模态与时序扩展及多智能体通信开销仍待优化"
  ],
  "unresolved_questions": [
    "LEVIR-CD 变化检测评测中 F1 与 IoU 指标命名约定存在未决差异"
  ],
  "author_argument": {
    "thesis": "RingMoClaw 通过异构 Critic 与双流动态经验总线，在遥感多任务自演化探索中实现了超越基线模型与对标开源框架的探索效率与精度增益。",
    "progression": [
      "ARG-01",
      "ARG-02",
      "ARG-03",
      "ARG-05"
    ],
    "intended_interpretations": [
      "作者认为双流经验与 Critic 机制形成了有效自演化闭环。"
    ]
  },
  "assessed_argument": {
    "justified_thesis": "RingMoClaw 通过异构 Critic 与双流动态经验总线，在遥感多任务自演化探索中实现了超越基线模型与对标开源框架的探索效率与精度增益。",
    "supported_units": [
      "ARG-01",
      "ARG-02",
      "ARG-03",
      "ARG-05"
    ],
    "weakened_units": [
      "ARG-04"
    ],
    "alternative_explanations": [],
    "epistemic_assessment": "外推范围取决于论文报告的实验条件与证据覆盖。"
  },
  "evidence_promotion": {
    "narrative_core": [
      "F01",
      "F02",
      "F04",
      "F05",
      "T01",
      "T06",
      "T07",
      "T08",
      "T09",
      "T10"
    ],
    "narrative_support": [],
    "audit_only": [
      "F03",
      "F06",
      "F07",
      "F08",
      "F09",
      "T02",
      "T03",
      "T04",
      "T05",
      "T11"
    ],
    "uncertain": [],
    "evidence_roles": {
      "F01": "narrative_core",
      "F02": "narrative_core",
      "F03": "audit_only",
      "F04": "narrative_core",
      "F05": "narrative_core",
      "F06": "audit_only",
      "F07": "audit_only",
      "F08": "audit_only",
      "F09": "audit_only",
      "T01": "narrative_core",
      "T02": "audit_only",
      "T03": "audit_only",
      "T04": "audit_only",
      "T05": "audit_only",
      "T06": "narrative_core",
      "T07": "narrative_core",
      "T08": "narrative_core",
      "T09": "narrative_core",
      "T10": "narrative_core",
      "T11": "audit_only"
    }
  }
}
